title,content
Free JavaScript Workshop at Codeup Dallas on 6/28,"Event Info: 
Location – Codeup Dallas
Time – 6 pm 
Come Learn JavaScript
Join us for our live in-person JavaScript crash course, where we will dig into one of the fastest-growing languages in the software development industry. It’s free and open to all – you don’t need to have any previous programming knowledge to participate. 
By the end of the presentation, you will:

Have a good understanding of what programming means
Know what JavaScript is and how it’s used
The best part: we will get our hands dirty writing some JavaScript. 

Don’t worry…we’ll walk you through every step. Come learn to code live with our very own instructor staff. Maybe this will be your jumpstart into an exciting and in-demand career…for FREE! 
Parking
You can park inside our gragae at our building! Just take a ticket. Once our workshop is over you can stop by the security desk and they will validate your parking for you. 
Must be 18+ to participate."
Is Our Cloud Administration Program Right for You?,"Changing careers can be scary. The first thing you may be asking yourself is, “where do I begin?” If you are looking into a career in tech, but coding or statistics aren’t your thing, our brand new Cloud Administration program might be just for you!
What Exactly is Cloud Administration?
The future is in the cloud! As the new way of doing business, all kinds of companies need to build or interact with cloud products. These aren’t just high-tech solutions – they’re the core of everyday products like cloud-based gaming from Xbox, collaborative work tools from Google Drive, and even music streaming services from Spotify! A Cloud Administrator works with software developers to design, build, maintain, and optimize a cloud architecture to run software applications.
What Will You Learn?
Just like our Data Science and Web Development programs, the Cloud Administration program is considered a career accelerator. Unlike a traditional 4 year degree, you can complete our program in just 15 weeks! You will receive hands-on training in:

Networking fundamentals
Linux Operating System
Windows Operating System
Cloud and Computer Security
Amazon Web Services (AWS Cloud)

You’ll even earn two industry-recognized certifications as an AWS Cloud Practitioner and AWS Solutions Architect Associate, fully included in your tuition. You’ll learn how each technology works together, and how they are applied to real projects by starting simple, then progressively getting more complex as you add more tools to your toolbox. We’ll teach you to build infrastructure that enables software and data science products, manage cloud deployments, and optimize for cloud performance. 
As for instruction, we are dedicated to giving you the best. Your instructors are speaking from real industry experience, and are invested in every student’s success. They’re essentially your personal mentors providing on-the-ground support, making themselves accessible to you when you need them. 
Your Success
Not only will you be equipped with in-demand cloud skills, but you’ll also get professional development along the way, including help polishing your resume and LinkedIn, as well as access to our employer network. This program, with the support of our career coaches and placement team, can help you become a: 

Cloud Administrator
Cloud Architect
Cloud Engineer
Cloud Network Engineer
Cloud Security Engineer 

You’re not stuck in one lane when you come to Codeup. With our instructors, coaches, and placement team you can take what you learn and run with it. Cloud technology is improving every single day and this course can ensure you are at the forefront of helping build and maintain that technology. 
Codeup Payment Options
Financing your career transition can be a bit stressful, but we never want it to stop you from changing your career and applying. We have a dedicated Financial Aid and Enrollment team to walk you through every possible option to pay for your tuition here at Codeup. Whether you are using your VA benefits, grants, loans, scholarships, or self-paying, our team will work with you to ensure you receive all forms of financial aid for which you qualify. You can change your career regardless of your financial situation.
Want more information on our Cloud Administration program? Check our student reviews, and our blog on 5 Reasons We Think You Should Attend the Cloud Administration program. You can do more than dream of this life-changing career – you can LIVE IT!. Our application process is the first step to beginning your journey in Cloud Administration today!"
PRIDE in Tech Panel,"In celebration of PRIDE month, join our Codeup Alumni from the LGBTQIA+ community as they discuss their careers in tech!
Hosted by Codeup’s Katie Facemire, our panel will discuss what it was like to attend Codeup, what it’s like to work in tech, and what challenges they face working the tech community as a member of LGBTQIA+. Joining us on the panel will be Benjamin Hodge, Natasha Rivers, and Steven Garis. As we mentioned, all three are Codeup Alumni.
The panel is free to attend virtually, but you must register on the page below. Once you register we will send you the exclusive Livestream link.
Thanks for registering and we will see you soon!"
Inclusion at Codeup During Pride Month (and Always),"Happy Pride Month! Pride Month is a dedicated time to celebrate and support the LGBTQIA+ community. At Codeup, one of our core values is Cultivating Inclusive Growth, something that takes on many shapes, sizes, forms, and colors. From representation in tech to empowering and supporting all, let’s reflect on how we live out this core value for our LGBTQIA+ community, not just during Pride Month, but always.
Cultivating Inclusive Growth
We’re firm believers that the people making tech should look like the people using it, which is everyone. We’re proud to offer Pride Scholarships year round, which aim to increase, support, and promote representation of the LGBTQIA+ community in tech. However, representation is only one part of cultivating inclusive growth. We want to help create a thriving tech community where everyone feels represented, but also safe and empowered.
In a 2019 survey conducted by Blind, 83% of LGBQ technologists and 78% of trans or gender non-conforming technologists reported that they felt safe in the workplace. In 2020, those numbers dropped to 76% and 64%, respectively.
Why the drop? Maybe recent pushes for representation in tech weren’t followed up with efforts to truly cultivate inclusivity and growth.
Codeup Initiatives
To cultivate inclusive growth, we don’t stop at representation. We also empower and support our community so that no one feels unsafe. Our internal DEI Taskforce empowers our staff with resources and conversations that aim to create a diverse culture of support, safety, and inclusivity for each other and our students.
Equipped with this knowledge, our staff can cultivate inclusive growth from the first time they interact with an applicant all the way until they get placed into a new job. They may have even felt empowered just by seeing our students and staff sporting their Pride t-shirts around town. 
Not only do we want the people making tech to look like the people using it, we also want them to feel safe and empowered to do so.
If you’re looking for a career in tech, let us empower you every step of the way! First, apply now. Then, apply for our Pride Scholarship."
Mental Health First Aid Training,"As a student of Codeup, going through a massive career transition can be mentally taxing. Did you know that members of our student-facing staff and human resources team are trained in Mental Health First Aid? Let’s dive into what that means for Codeup! 
Mental Health First Aid Training 
Some of our Codeup staff that works directly with our students are trained in Mental Health First Aid. This includes members of our student experience team, career coaches, and the human resources department. This training was courtesy of the Center for Health Care Services in San Antonio. They graciously provided the funding and training for our team in this pilot training program. 
What is Mental Health First Aid? According to mentalhhealthfirstaid.org, “is a course that teaches you how to identify, understand, and respond to signs of mental illness and substance use disorders. The training gives you the skills you need to reach out and provide initial help and support to someone who may be developing a mental health or substance use problem or experiencing a crisis”.
To be clear, our staff are not licensed, mental health professionals. What MHFA equips our staff with are tools to gauge risk and connect students and staff with the help they might need. This might include recognizing something in a meeting, picking up on cues during a casual conversation, or acting on a pattern behavior. 
How does this help our students?
Many who go through Codeup’s programs will tell you it is both rewarding and challenging all at the same time. Some students have compared learning at Codeup to  “drinking from a firehouse”. You learn so much at once, so fast. This style of learning if you are not used to it can be taxing on anyone’s mental fortitude. This allows our staff who work closely with the students to be able to identify if a student is in need of mental health help. 
Consider Your Career Change Today
Why does this skill set matter? You! We’re here to support your career transition as best we can, and Mental Health First Aid training is just one small piece of that larger support effort. Learn more about how we can support your career transition by applying today."
Codeup Dallas: How to Succeed at a Coding Bootcamp on June 9th,"This event is the perfect opportunity for people that have been wondering what to expect in a coding bootcamp and how to make the most of it. This event is for everyone, but especially great for recently admitted students and applicants still working through the admissions process, and/or those considering whether or not to take the leap into a coding bootcamp! We’ve seen hundreds of people come through our bootcamp – hear the keys to success (and common pitfalls) we’ve seen repeated over and over! 
Hosted by: Dimitri Antoniou, VP of Strategic Initiatives 
This event in person at our brand new Dallas campus!"
5 Reasons To Attend Our New Cloud Administration Program,"Come Work In The Cloud
When your Monday rolls around, do you start to get a sense of dread? That might be a sign to break up with your current job and learn something new. At Codeup, we don’t want you to keep your head in the clouds while working a job you can’t stand. You should learn all about the cloud and cloud technology! As we charge forward into 2022, we recently announced our brand new Cloud Administration Program. 
This is a 15-week career accelerator that gets you hands-on experience with:

Networking
Linux Operating System 
Windows Operating System 
Security 
Amazon Web Services (AWS) Cloud Technology

You’ll earn two industry-recognized certifications as an AWS Cloud Practitioner and AWS Solutions Architect Associate. Both are included as part of your tuition. You will learn how to build infrastructure that enables software and data science products, manage cloud deployments, and optimize for cloud performance. 
Here are 5 reasons why we think you should attend our Cloud Administration program: 
 
1.) The Campus 
Located on Rackspace property, our Castle campus has everything you need. Tabletop games to play with classmates on break? We got foosball and ping pong! Need a drink to quench your thirst? We have complimentary soda, water, and tea. 
There is also lots of seating across the campus for you to study, have lunch, or even meet with classmates. 
Parking is free since we are located on Rackspace’s property. You have the option to park about 100 ft away from our building, or you can park on the underground level to save your car from the heat if you attend during the summer months. 
There is also plenty of food options within driving distance of campus. Fast food options include Mcdonald’s, Panda Express, and Bill Miller’s BBQ. For more sit-down restaurant options, you can visit Applebee’s, Buffalo Wild Wings, or Olive Garden. If you want to bring your lunch we have microwaves and refrigerators to enjoy your lunch on campus. 
 
2.) Time and Money Spent 
In just 15 weeks you will be on your way to a new career that’s in high demand! That means you won’t have to wait 2 – 4 years like other traditional degree plans to get started in your new career. 
Is the cost of our program a concern? We totally understand if it is. Our Cloud Administration program is also the most affordable option of our three programs at Codeup if you’re looking to save the most money. It’s also more affordable than a traditional degree. 
At Codeup we have a dedicated team of Financial Aid and Enrollment managers who will work with you one on one to ensure you have everything you need to pay for your time at Codeup that makes sense for your individual situation. 
We have grants, scholarships, and student loans for those who qualify. If you’re a Veteran or a dependant of a Veteran you might have GI Bill benefits for use at Codeup. We just launched an exclusive scholarship with Climb Credit that you can apply for here. 
Lastly, you can always go through your own financial institution to see what options are available to pay for Codeup. 
Check out a walkthrough of our financial aid options here. 
 
3.) Salary & Benefits 
Almost everyone changing careers during the “Great Resignation” is doing it for better pay and better benefits. 
What if I told you that any career you obtain through our Cloud Administration program offered you both a better salary and better benefits? 
According to Indeed.com the average salary for a Cloud Engineer right now is $118,712 in Texas (which is similar to the National average). This mirrors a Glassdoor Median Base salary of $118,999. Glassdoor also notes a job satisfaction rating of 4 out of 5 and over 10K open roles under the title Cloud Engineer. 
Are you guaranteed a salary like that after graduation? Not necessarily since this was an average salary. However, what that means is you have the potential to get to that level of salary at some point in your new career.
Your new skill sets could land you at a larger company like Accenture, EY, or even USAA. On the other hand, you could end up at a small company like a startup or SaaS (software as a service) company. 
Both of those options will typically give you things like a great health care plan, generous amounts of time off, and additional perks like continuing education and gym discounts. Startups might be a little more unique in their offerings like remote work options, paying for new office equipment, and even potentially paying for an annual company retreat if the company works remotely. 
 
4.) Job Security
According to IT senior managers in a recent Robert Half survey, cloud expertise is the topmost in-demand skill set. This means cloud experts are in high demand and will continue to be as more companies adopt cloud infrastructures. The curriculum you go through in this program won’t stick you to just one lane. Coming out of the Cloud Administration program you could land a job as a: 

Cloud Engineer
Cloud Network Engineer 
Cloud Security Engineer 
Cloud Architect 
Cloud Administrator 

Having this many career options to choose from makes you a valuable and in-demand candidate for any tech company big or small. At Codeup, we have an employer-influenced curriculum. So once you graduate, you are equipped with the latest skills and knowledge today’s employers are looking for. 
 
5.) Our Instructors Are Next Level 
Our instructors genuinely care about your success. They lecture and take questions in real-time. Instead of giving you the answer, they will guide you in the right direction until you understand it yourself. They are all responsive and engaging, with a commitment to your success and a mission of empowering life change. 
At other boot camps, you won’t find the same quality of instructors with industry experience, subject matter expertise, and live interactive lectures and lab. Even at the college level, professors often don’t provide individualized attention, hands-on learning, or accountability. Our instructors make a difference in your learning journey. 
If having awesome instructors wasn’t enough, we also have a dedicated Student Experience team. This team is designed to work in collaboration with our instructors to ensure your success. Need a one-on-one session with your instructor? They can help with that. Need help just managing your time better? They can help with that too! These are passionate education professionals who want to empower you to get to that finish line we call graduation! 
Read more about why you need the best coding Bootcamp instructors here. 
 
Wrapping Up
As we mentioned, as more companies adopt cloud technologies the demand for cloud experts will only continue to grow. Take this as a sign to launch your career in tech and attend our brand new Cloud Administration program today. 
Our next class starts June 16th so don’t wait to get started and fill out this form here for our admissions team to get in touch with you. You can beat the heat this summer, learn new skills, and launch your career in the cloud! We can’t wait to hear from you!"
Learn to Code: Python on 5/21,"According to LinkedIn, the “#1 Most Promising Job” is data science! One of the major building blocks of data science is Python. What is data science? What is Python? If you’re curious, join this free virtual workshop to learn the basics of Python from our very own Data Science instructors and get an introduction to the field of data science, brought to you live from the comfort of your own home.
Python is the dominant programming language in data science, used to manipulate data, conduct analysis, and apply machine learning algorithms. You will gain hands-on practice with programming Python including syntax, data types, control structures, and functions. Don’t worry — no prior experience is needed to participate in this workshop.
Save your seat quickly – our Python workshops are always in high demand! 
What you need:
1. Laptop (does not matter what kind). You need to be able to access WiFi and run an internet browser.
2. To RSVP!
You must be 18+ to attend the workshop and also must live in the United States. The ticket is subject to cancellation if under 18 or live outside the US. of"
Codeup Dallas Joins Career Day,"Last week our Codeup Dallas team participated in Career Day at James Madison High School which also included students from Lincoln High School. This Career Day was an initiative by United Way Dallas. Toyota, Goodwill, Dallas college, and the US Army we’re all in attendance as well to support the Career Day. 
Our team directly impacted about 60 students! We held three 45 minute sessions where we talked about the following: 

Non-traditional career paths 
The different careers in tech 
Provided resources for creating a solid first resume 
Discussed what we each did at Codeup 

We wrapped up each session with a fun Kahoot review and awarded some Codeup swag to the top winners! 
We want to thank United Way Dallas for having us out to support our local Dallas community. If you would like our Coduep team to come out and talk to your students about non-traditional career paths like our career accelerator programs, email us at marketing@codeup.com. 
Check out more photos of the event on our Instagram page."
Project Quest Info Session: IT Jumpstart on May 24th,"Join our grant partner Project Quest as they discuss the latest program we offer called IT Jumpstart! This is a great program for anyone looking to make the jump into the IT industry. This is a lunchtime event so come bring your lunch, bring your questions, and get ready to learn all about IT Jumpstart from Project Quest!"
From Bootcamp to Bootcamp | A Military Appreciation Panel,"In honor of Military Appreciation Month, join us for a discussion with Codeup Alumni who are also Military Veterans! We will chat about their experiences attending a coding bootcamp, and how their military training set them up for success here at Codeup. Grab your virtual seat now so you can be sent the exclusive Livestream link on the 11th! 
Thank you to our panelists for participating: 

Christopher Aguirre
Taryn McKenzie 
Desiree McElroy 


And thanks to Codeup’s Trey Iapachino who is also an Air Force Veteran!"
Our Acquisition of the Rackspace Cloud Academy: One Year Later,"Just about a year ago on April 16th, 2021 we announced our acquisition of the Rackspace Cloud Academy! For a short time after the acquisition, it was rebranded as the Codeup Cloud Academy and is now a full-time part of the Codeup brand. You can read our blog when we announced this last year by clicking here. 
To look back at the past year, we checked in with Marcus Benavidez and Mike Jaime who stayed with Codeup after previously working with the Rackspace Cloud Academy. We also checked in with Dimitri Antoniou who is our VP of Strategic Initiatives and helped with the merger of the two companies. We asked them questions about the current campus, and also what the future may look like at Codeup’s new “Castle” campus. 
What makes Codeup’s new “Castle” campus so special?
Mike Jamie: Its history! Rackspace and former Rackers were instrumental in jumpstarting the tech industry here in San Antonio. This includes Geekdom, where Codeup was established. The Castle is where Rackspace ultimately decided to call its international headquarters. 
Marcus Benavidez: The campus is designed with the student experience in mind. This includes the large classrooms and facilities to match. It’s a piece of San Antonio history as it’s on the Rackspace Campus. 
Dimitri Antoniou: The Castle has been a staple of tech in San Antonio for years. Train new tech employees in high-growth careers like Cloud Administration from the Castle campus is an exciting extension of the legacy of Rackspace’s impact on San Antonio.
What new traditions have you created at the Castle or would to start since the acquisition?
Mike: A way to implement a version of “Rookie O” across staff and cohorts. 
Marcus: I would love to see some kind of Alumni wall or recognition for Alumni past, present, and future. 
Since it’s been 1 yr since the acquisition, where do you see our Castle campus in 3, 5, or even 10 years from now?
Marcus: It will be awesome once Web Development and Data Science programs are approved on this campus. I am looking forward to the cross-pollination of technologies, students, and staff. 
Dimitri: Maybe we will have our own mall to ourselves one day
What advice would you give to those considering our new Cloud Administration program?
Mike: If you’re looking to get your foot in the door, I think it’s a no-brainer as you will be learning AWS administration, which is the most in-demand cloud computing platform. Also, the decision to focus on hands-on experience and know-how as opposed to certification exam memorization will better prepare students with practical knowledge.
Marcus: Do it. The time to positively impact your life and to create change is now.
Dimitri: Skills in networking, Linux, and AWS can put you on a path to so many different careers, including cybersecurity and cloud architecture. These are some of the highest growth and most exciting pathways in technology. With experienced experts like Jeremy Price and Kris Connolly to teach you, there’s no better way to open doors in IT.
What programs could you see being delivered at the Castle campus in the future?
Mike: Cybersecurity again! Also Web Development and Data Science as well. 
Marcus: We should continue to build and offer classes that align with the market [i.e. what skills are in high demand]. 
Dimitri: AWS is one of 3 major cloud providers, along with Microsoft Azure and Google Cloud. I think it won’t be long until we’re training a variety of cloud careers across all major players.
The Castle has ping pong and foosball. What other indoor competitive game would you add?
Mike: Air Hockey and Shuffle Board
Marcus: Vintage Arcade games would be awesome! 
Dimitri: There’s so much open space – I’d love to run a nerf gun or dodgeball tournament!
Join our new Cloud Administration Program
Tinkerers, computer enthusiasts, mechanics, or really anyone who likes to fix and build things will love our brand new Cloud Administration program. The foundation of skills you will learn could land you a job in Cloud Architecture, Cybersecurity, DevOps, & Solutions Engineering. You will learn new skills in just 15 weeks, and won’t break the bank like a traditional 4-year college degree. Our next class starts on 5/31. 
Our Castle campus includes the following perks: 

Hands-on labs to get real-time hands-on experience
Live classroom instruction
Ping pong and foosball tables 
Lots of comfortable seating options to break out and study or just relax 
A large cafeteria area 
Free Coffee, Tea, Water, and Soda 
We also have a vending machine for additional drinks and snacks 
Free covered parking 
Located at Rackspace’s headquarters 

If you are looking to change your career, there is no better time than now! Classes for this new program will fill up fast so don’t delay!"
